---
title: Документы
---

Здесь вы можете ознакомиться с уставными документами, лицензиями и другой официальной документацией нашего Центра.

### Уставные документы
* {% include doc-link.html text="Устав" uri="files/docs/charter.docx" %}
* {% include doc-link.html text="Коллективный договор" uri="files/docs/collective-agreement.doc" %}
* {% include doc-link.html text="Приказ об утверждении Устава от 09.11.2011" uri="files/docs/order_1_1.jpg" %}
* {% include doc-link.html text="Приказ о реорганизации от 24.11.2014" uri="files/docs/order_2_1.jpg" %} |
  {% include doc-link.html text="лист 2" uri="files/docs/order_2_2.jpg" %}
* {% include doc-link.html text="Приказ об утверждении Устава от 17.07.2015" uri="files/docs/order_3_1.jpg" %} |
  {% include doc-link.html text="лист 2" uri="files/docs/order_3_2.jpg" %}
* {% include doc-link.html text="Приказ об утверждении Устава от 01.10.2015" uri="files/docs/order_4_1.jpg" %} |
  {% include doc-link.html text="лист 2" uri="files/docs/order_4_2.jpg" %}
* {% include doc-link.html text="Приказ о директоре от 03.07.2014" uri="files/docs/order_director_1.jpg" %}
* {% include doc-link.html text="Приказ о трудовом договоре с директором от 06.07.2015" uri="files/docs/order_director_2.jpg" %}

### Лицензии
* {% include doc-link.html text="Лицензия на осуществление образовательной деятельности" uri="files/docs/license_education_1.jpg" %} |
  {% include doc-link.html text="оборотная сторона" uri="files/docs/license_education_2.jpg" %} |
  {% include doc-link.html text="Приложение № 1.1" uri="files/docs/license_education_3.jpg" %}
* {% include doc-link.html text="Лицензия на осуществление медицинской деятельности" uri="files/docs/license_medical_1.jpg" %} |
  {% include doc-link.html text="оборотная сторона" uri="files/docs/license_medical_2.jpg" %} |
  {% include doc-link.html text="Приложение № 1 (стр. 1)" uri="files/docs/license_medical_3.jpg" %}
  {% include doc-link.html text="Приложение № 1 (стр. 2)" uri="files/docs/license_medical_4.jpg" %}
* {% include doc-link.html text="Лицензия на осуществление фармацевтической деятельности" uri="files/docs/license_pharmacy_1.jpg" %} |
  {% include doc-link.html text="оборотная сторона" uri="files/docs/license_pharmacy_2.jpg" %} |
  {% include doc-link.html text="Приложение № 1" uri="files/docs/license_pharmacy_3.jpg" %}
* {% include doc-link.html text="Лицензия на деятельность по обороту НС, ПВ и их прекурсоров, культивированию НСР" uri="files/docs/license_ns_1.jpg" %} |
  {% include doc-link.html text="оборотная сторона" uri="files/docs/license_ns_2.jpg" %} |
  {% include doc-link.html text="Приложение № 1 (лицевая сторона)" uri="files/docs/license_ns_3.jpg" %} |
  {% include doc-link.html text="Приложение № 1 (оборотная сторона)" uri="files/docs/license_ns_4.jpg" %}

### Свидетельства, заключения, уведомления
* {% include doc-link.html text="Свидетельство о государственной регистрации (19.08.2015)" uri="files/docs/state-registration-certificate_2015-08-19.pdf" %}
* {% include doc-link.html text="Свидетельство о внесении записи в ЕГРЮЛ (23.11.2011)" uri="files/docs/registry-certificate_2011-11-23.pdf" %}
* Листы записи ЕГРЮЛ:
  {% include doc-link.html text="04.06.2015" uri="files/docs/registry_2015-06-04.pdf" %} |
  {% include doc-link.html text="18.07.2015" uri="files/docs/registry_2015-07-18.pdf" %} |
  {% include doc-link.html text="28.07.2015" uri="files/docs/registry_2015-07-28.pdf" %} |
  {% include doc-link.html text="22.10.2015" uri="files/docs/registry_2015-10-22.pdf" %} |
  {% include doc-link.html text="17.11.2015" uri="files/docs/registry_2015-11-17.pdf" %} |
  {% include doc-link.html text="24.08.2016" uri="files/docs/registry_2016-08-24.pdf" %}
  {% include doc-link.html text="06.12.2018" uri="files/docs/registry_2018-12-06_01.jpg" %} | {% include doc-link.html text="лист 2" uri="files/docs/registry_2018-12-06_02.jpg" %}
* {% include doc-link.html text="Свидетельство о постановке на налоговый учет" uri="files/docs/tax-accounting-certificate.pdf" %}
* {% include doc-link.html text="Уведомление о снятии с учета в налоговом органе (Дом ребенка № 21; 07.07.2015)" uri="files/docs/tax-authority-registration-cancellation_2015-07-07.pdf" %}
* {% include doc-link.html text="Санитарно-эпидемиологическое заключение (08.07.2016)" uri="files/docs/sanitary-conclusion_2016-07-08.pdf" %}

### Отчеты
* {% include doc-link.html text="Отчет о результатах самообследования (2017–2018)" uri="files/docs/self-examination-report_2017-2018.docx" %}
* Отчет Попечительского совета:
  {% include doc-link.html text="2018" uri="files/docs/trustee-board-report_2018.pdf" %} |
  {% include doc-link.html text="2017" uri="files/docs/trustee-board-report_2017.pdf" %} |
  2016 ({% include doc-link.html text="лист 1" uri="files/docs/trustee-board-report_2016_1.jpg" %},
  {% include doc-link.html text="лист 2" uri="files/docs/trustee-board-report_2016_2.jpg" %})
* {% include doc-link.html text="Информация о результатах проведенных проверок (2016–2018)" uri="files/docs/inspections_2016-2018.docx" %}
* Отчёт директора:
  {% include doc-link.html text="2018" uri="files/docs/director-report_2018.docx" %}
* {% include doc-link.html text="Отчёт о социализации воспитанников в ГКУ ЦССВ «Сколковский»" uri="files/docs/socialization-report.docx" %}
* {% include doc-link.html text="Информация об обучении педагогических работников организации за период 2017–2018 гг." uri="files/docs/staff-education_2017-2018.doc" %}

### Другие документы
* {% include doc-link.html text="Правила внутреннего распорядка" uri="files/docs/internal-regulation.docx" %}
* {% include doc-link.html text="Режим дня" uri="files/docs/daily-schedule.pdf" %}
* Сводная ведомость проведения специальной оценки условий труда:
  {% include doc-link.html text="2019" uri="files/docs/working-conditions-inspection_2018.pdf" %} |
  {% include doc-link.html text="2017" uri="files/docs/working-conditions-inspection_2017.pdf" %}
* {% include doc-link.html text="План мероприятий по улучшению условий и охраны труда работников" uri="files/docs/working-conditions-improvement-plan.pdf" %}

### Положения и приказы

В ГКУ ЦССВ «Сколковский» приняты и действуют следующие положения о деятельности организаций для детей-сирот и детей,
оставшихся без попечения родителей, и об устройстве в них детей, оставшихся без попечения родителей, утвержденного
постановлением Правительства Российской Федерации от 24 мая 2014 г. № 481 «О деятельности организаций для детей-сирот
и детей, оставшихся без попечения родителей, и об устройстве в них детей, оставшихся без попечения родителей».

1. {% include doc-link.html text="Положение об отделе содействия семейному устройству" uri="files/docs/regulation_family-placement-department.pdf" %}, сопровождения кровных и замещающих семей от 06.09.2017.
2. {% include doc-link.html text="Положение о дополнительном образовании воспитанников" uri="files/docs/regulation_additional-education.pdf" %} в Государственном казенном учреждении ЦССВ «Сколковский» № 107-а от 16.11.2016.
3. {% include doc-link.html text="Положение о порядке создания, организации работы и принятия решений комиссией по урегулированию споров" uri="files/docs/regulation_dispute-resolution.pdf" %} между участниками образовательных отношений № 106-а от 16.11.2016.
4. {% include doc-link.html text="Положение о Службе внутреннего контроля" uri="files/docs/regulation_internal-control.pdf" %} ГКУ ЦССВ «Сколковский» от 31.05.2017.
5. {% include doc-link.html text="Положение о режиме дня" uri="files/docs/regulation_daily-schedule.pdf" %} в Государственном казенном учреждении города Москвы Центре содействия семейному воспитанию «Сколковский» Департамента труда и социальной защиты населения города Москвы от 01.09.2016.
6. {% include doc-link.html text="Положение об организации и проведении выходов и выездов воспитанников" uri="files/docs/regulation_outings.pdf" %} за пределы территории учреждения от 01.08.2016.
7. {% include doc-link.html text="Положение о комплексной безопасности воспитанников" uri="files/docs/regulation_security.pdf" %} ГКУ ЦССВ «Сколковский» от 11.01.2016.
8. {% include doc-link.html text="Положение об организации работы кабинета М. Монтессори" uri="files/docs/regulation_montessori.pdf" %} в Государственном казенном учреждении Центре содействия семейному воспитанию «Сколковский» Департамент труда и социальной защиты населения города Москва от 01.09.2016.
9. {% include doc-link.html text="Положение о рабочей программе педагога" uri="files/docs/regulation_work-program.pdf" %} ГКУ ЦССВ «Сколковский» Государственного казенного учреждения города Москвы Центра содействия семейному воспитанию «Сколковский» Департамента и социальной защиты населения города Москвы от 27.08.2015.
10. {% include doc-link.html text="Положение о методическом объединении" uri="files/docs/regulation_methodical-association.pdf" %} педагогических работников
11. {% include doc-link.html text="Положение о педагогическом совете" uri="files/docs/regulation_pedagogical-council.pdf" %} педагогических работников от 01.06.2015.
12. {% include doc-link.html text="Положение о порядке выплаты денежных средств на личные нужды" uri="files/docs/regulation_monetary-payments.pdf" %} детей-сирот и детей, оставшихся без попечения родителей, находящихся в ГКУ ЦССВ «Сколковский».
13. {% include doc-link.html text="Положение об обработке персональных данных" uri="files/docs/regulation_personal-data.pdf" %} воспитанников ГКУ ЦССВ «Сколковский», родителей (законных представителей), работников учреждения.
14. {% include doc-link.html text="Положение о защите прав и законных интересов воспитанников" uri="files/docs/regulation_rights-protection.pdf" %} ГКУ ЦССВ «Сколковский»
15. {% include doc-link.html text="Положение о зачислении, переводе и отчислении воспитанников" uri="files/docs/regulation_enrollment.pdf" %} ГКУ ЦССВ «Сколковский» от 10.06.2017.
16. {% include doc-link.html text="Положение Медико-психолого-педагогического консилиума" uri="files/docs/regulation_mppc.pdf" %} ГКУ ЦССВ «Сколковский».
17. {% include doc-link.html text="Положение о Дополнительной адаптированной общеобразовательной и общеразвивающей программе" uri="files/docs/regulation_additional-program.pdf" %} социально-педагогической направленности для детей-сирот и детей, оставшихся без попечения родителей, с ограниченными возможностями здоровья ГКУ ЦССВ «Сколковский».
18. {% include doc-link.html text="Положение о дошкольном образовании" uri="files/docs/regulation_preschool.pdf" %} в ГКУ ЦССВ «Сколковский».
19. {% include doc-link.html text="Положение о структурном подразделении «Бухгалтерия»" uri="files/docs/regulation_dept_bookkeeping.pdf" %}.
20. {% include doc-link.html text="Положение о структурном подразделении «Руководство»" uri="files/docs/regulation_dept_administration.pdf" %}.
21. {% include doc-link.html text="Положение о структурном подразделении «Служба медицинской помощи детям»" uri="files/docs/regulation_dept_medical.pdf" %}.
22. {% include doc-link.html text="Положение о структурном подразделении «Административно-хозяйственный отдел»" uri="files/docs/regulation_dept_economic.pdf" %}.
23. {% include doc-link.html text="Положение о структурном подразделении «Пищеблок»" uri="files/docs/regulation_dept_nutrition.pdf" %}.
24. {% include doc-link.html text="Положение о структурном подразделении «Отдел кадров»" uri="files/docs/regulation_dept_personnel.pdf" %}.
25. {% include doc-link.html text="Положение о структурном подразделении «Служба психолого-педагогического и социального сопровождения детей»" uri="files/docs/regulation_dept_children-support.pdf" %}.
